Titulo_Libro;Autor;Subtitulo_Libro;Cantidad_Ejemplares;Edicion;Año_Publicacion;Item_Number
Medicina preventiva.;Rodríguez, Germinal;sin datos;1;sin datos;1945.;7787
Higiene y profilaxis.;Rodríguez, Germinal;sin datos;1;sin datos;1944.;7788
Higiene individual y medio externo.;Rodríguez, Germinal;sin datos;1;sin datos;1945.;7789
Higiene pública.;Rodríguez, Germinal;sin datos;1;sin datos;1945.;7790
Medicina social.;Rodríguez, Germinal;sin datos;1;sin datos;1945.;7791
Energía solar para el hombre.;Brinkworth, B. J;sin datos;1;1a ed.;1981.;7792
Escuela del motor Diesel :;Schwarzbock, Ernesto P. J;de la práctica para la práctica y el estudio.;6;sin datos;1952.;7793
Trucaje de motores de cuatro tiempos.;Castro, Vicente Miguel de;sin datos;1;3a ed.;1964.;7794
Curso de servicio y reparación Diesel.;sin datos;sin datos;1;sin datos;1944.;7795
Tecnología de procesamiento de minerales :;Wills, Barry A;tratamiento de menas y recuperación de minerales.;1;1a ed.;1994.;7796
Elementos de máquinas.;Simpson, W;sin datos;1;sin datos;1947.;7797
El taller del torneado :;Berra, Francisco J;lecciones teórico prácticas para los aprendices mecánicos.;3;sin datos;1977.;7798
El taller del ajuste :;Berra, Francisco J;lecciones teórico prácticas para los aprendices mecánicos.;3;sin datos;1977.;7799
Técnica de la medición y trazado.;Kurrein, Max;sin datos;1;2a ed.;1945.;7800
La técnica del embutido de planchas-El Trazado en la calderería.;Sellin, Walter;sin datos;1;sin datos;1954.;7801
Geografía: la Argentina y el Mercosur.;Echeverría, María Julia;sin datos;5;sin datos;2004;7802
Manual de Normas IRAM de dibujo tecnológico.;sin datos;sin datos;2;sin datos;2004.;7803
La industrialización del siglo XX.;Perroux, Francois;sin datos;1;2a ed.;1964.;7804
Historia :;Pigna, Felipe;la Argentina contemporánea.;5;sin datos;2000.;7805
Sociedad en red 7 :;Jungman, Esteban;historia, geografía, formación ética y ciudadana, economía, historia del arte.;5;sin datos;2002.;7806
Matemática en red 8 EGB 3o Ciclo.;López, Alicia;sin datos;2;sin datos;[20--];7807
Matemática en red EGB 3o Ciclo.;López, Alicia;sin datos;2;sin datos;2001.;7808
Matemática en red 7 EGB 3o Ciclo.;López, Alicia;sin datos;2;sin datos;2001.;7809
Sociedad en red 9 EGB 3o Ciclo.;sin datos;sin datos;7;sin datos;[20--];7810
Sociedad en red 8 egb 3o ciclo.;sin datos;sin datos;6;sin datos;2000.;7811
Naturaleza en red 7 EGB 3o Ciclo.;Bassarsky, Magalí;sin datos;2;sin datos;2001.;7812
Naturaleza en Red 8 EGB 3o Ciclo.;Bassarsky, Magalí;sin datos;2;sin datos;2001.;7813
Naturaleza en red 9 EGB 3o Ciclo.;Bassarsky, Magalí;sin datos;2;sin datos;2002.;7814
La formación del Estado argentino :;Oszlak, Oscar;orden,  progreso y organización nacional.;1;sin datos;[19--];7815
Diccionario español-inglés.;sin datos;sin datos;1;sin datos;1971.;7816
Tomo la palabra 7.;Petruzzi, Herminia;sin datos;1;sin datos;2001.;7817
Aventuras con la ciencia :;Canestro, Elsa;experimentos científicos.;1;3a ed.;1997.;7818
Historia de América Latina.;sin datos;sin datos;1;sin datos;1994.;7819
El dónde, cuándo y cómo del origen del hombre.;Ramírez Rozzi, Fernando;sin datos;1;sin datos;2001.;7820
Los dioses andinos :;Paleari, Antonio;algunos comentados, otros cotejados.;1;sin datos;1999.;7821
Mitos griegos.;Osborne, Mary Pope;sin datos;4;sin datos;2000.;7822
La crisálida.;González, Horacio;sin datos;1;sin datos;2001.;7823
Alfabetización científica y tecnológica.;Fourez, Gerard;sin datos;1;sin datos;1997.;7824
San Martín :;Argañaraz Alcorta, Rodolfo;Gral. José de San Martín Padre de la Patria.;1;sin datos;2000.;7825
Método y antimétodo :;Calello, Hugo;proceso y diseño de la investigación interdisciplinaria en Ciencias Humanas.;1;sin datos;1999.;7826
Aire.;Walpole, Brenda;sin datos;1;sin datos;1991.;7827
Electricidad e imanes.;Cash, Terry;sin datos;1;sin datos;1991.;7828
Sonido.;Cash, Terry;sin datos;1;sin datos;1991.;7829
Matemática 1.;sin datos;sin datos;1;sin datos;1995.;7830
Matemática 9 :;Hernaiz, Ignacio;cartas a medida.;1;1a ed.;1998.;7831
Grecia primitiva :;Finley, M. I;la edad de bronce y la era arcaica.;1;3a ed.;1987.;7832
Y usted ¿de qué se ríe?.;sin datos;sin datos;1;sin datos;1999.;7833
Matemática 9.;Semino, Susana;sin datos;2;sin datos;1997.;7834
Técnica de los alternadores modernos.;Lagoma, Alfonso;sin datos;1;3a ed.;1962.;7835
Lengua Pro-a EGB 7.;Céspedes, Cora;sin datos;1;sin datos;1997.;7836
Agua.;Walpole, Brenda;sin datos;1;sin datos;1988.;7837
Palabramundo 2 EGB.;Rey, Rosa María;sin datos;1;sin datos;1999.;7838
Lengua en uso EGB3 Nivel 2.;Nogueira, Sylvia;sin datos;1;sin datos;2000.;7839
Palabramundo 1 EGB.;Rey, Rosa María;sin datos;1;sin datos;1998.;7840
Tomo la palabra 9EGB :;Petruzzi, Herminia;curso de lengua.;1;sin datos;2001.;7841
Tomo la palabra 8EGB :;Petruzzi, Herminia;curso de lengua.;1;1a ed.;2001.;7842
Describir el escribir :;Cassany, Daniel;cómo se aprende a escribir.;1;1a ed.;1997.;7843
Tecnología industrial II ;sin datos;2o Bachillerato.;2;sin datos;[19--];7844
Estructuras de superficies alabeadas :;Catalano, Eduardo F;combinaciones de paraboloides hiperbólicos.;1;sin datos;1962.;7845
Dibujo técnico.;Evelson, M;sin datos;1;sin datos;1979.;7846
Dibujo técnico 1.;Guidobono, Hugo Ángel;sin datos;3;sin datos;1983.;7847
Dibujo técnico 2.;Guidobono, Hugo Ángel;sin datos;3;sin datos;1983.;7848
Tratado metódico de perspectiva.;Quaintenne, Esteban;sin datos;1;5a ed., corr.;1981.;7849
AutoCAD avanzado versión 12 :;López Fernández, Javier;incluye AME V.2, Render, Ase, Aplicaciones ADS.;1;sin datos;1993.;7850
Educación para la salud.;Vattuone, Lucy F. de;sin datos;1;14a ed.;1988.;7851
Tiempo y clima.;Parker, Steve;sin datos;1;sin datos;1995.;7852
El libro del Congreso 2002.;sin datos;sin datos;2;sin datos;2002.;7853
Electroquímica.;Rubio Felipe, Lamberto A;sin datos;1;1a ed.;2006.;7854
El joven astrónomo.;Snowden, Sheila;sin datos;1;sin datos;1984.;7855
Lengua, ciencias, escuela, sociedad :;Viramonte de Avalos, Magdalena;para una educación linguística integral.;1;sin datos;l977.;7856
Cuentos con espectros, sombras y vampiros.;sin datos;sin datos;2;1a ed.;2001.;7857
Tecnología 8.;Gotbeter, Gustavo;sin datos;1;6a ed.;2001.;7858
Saber sobre nuestros saberes :;Fourez, Gerard;un léxico epistemológico para la enseñanza.;1;sin datos;l997.;7859
La vida y el Universo.;Aljanati, David;sin datos;1;1a ed.;2000.;7860
Memoria e identidad.;Candau, Joel;sin datos;1;1a ed.;2001.;7861
Geografía y ciencias sociales :;Durán, Diana;mundo contemporáneo.;1;1a ed.;1998.;7862
Anatomía y fisiología.;Dos Santos Lara, José Ángel;sin datos;1;20a ed.;1974.;7863
Simulación dinámica de tiempo real :;Tarifa, Enrique;pasteurizador HTST.;1;sin datos;1998.;7864
Escritos sobre literatura.;Marx, Karl;sin datos;1;1a ed.;2003.;7865
El trabajado de los metales.;Schwoch, W;sin datos;1;sin datos;1945.;7866
Brochado :;Knoll, Leonard;aserrado de los metales.;1;sin datos;1945.;7867
El ABC de la construcción de modelos, máquinas y herramientas de trabajo de la madera.;Kadlec, Emil;sin datos;1;sin datos;1945.;7868
Manual del fundidor de metales.;Duponchelle, J;sin datos;1;sin datos;1942.;7869
Componentes electrónicos :;sin datos;descripción técnica y características para estudiantes.;1;sin datos;1987.;7870
Generación del vapor :;Mesny, Marcelo;combustión, hogares, gasógenos, calderas, tratamiento de aguas, economizadores, sobrecalentadores y precalentadores de aire.;2;sin datos;1946.;7871
Manual para instalaciones eléctricas de alumbrado y fuerza motriz.;sin datos;sin datos;1;2a ed.;1962.;7872
Organos de unión :;Pezzano, Pascual;elementos de máquinas I.;5;10a ed.;1979.;7873
Engranajes y poleas.;Pezzano, Pascual;sin datos;1;5a ed.;1966.;7874
Modelos y moldes para fundición.;Deslandes, Fernand;sin datos;1;sin datos;1966.;7875
Manual del taller de reparación y ajuste de automóviles y camiones.;Ferpi, J;sin datos;1;2a ed.;1950.;7876
Manual del ingeniero electricista.;Singer, Francisco L;sin datos;1;sin datos;1947.;7877
Manual del ingeniero.;sin datos;sin datos;4;2a ed.;1938.;7878
Manual del ingeniero químico.;Perry, John H;sin datos;1;sin datos;1966.;7879
Tratado de mecánica industrial.;Moulan, P. H;sin datos;1;5a ed.;1492.;7880
Bricolaje soldadura.;Pierre, Auguste;sin datos;1;4a ed.;1994.;7881
Blasters handbook.;sin datos;sin datos;1;sin datos;[19--];7882
Flotation.;Mayer, Erwin W;sin datos;1;sin datos;1931.;7883
Fabricación, aislamiento y cálculo de los conductores eléctricos.;Perrine, F. C. A;sin datos;1;sin datos;[19--];7884
Como soldar metales y aleaciones.;Richarson, E;sin datos;1;sin datos;1946.;7885
Curso de servicio y reparación Diesel.;Sani, Federico;sin datos;1;sin datos;1944.;7886
Energía solar.;Quadri, Néstor Pedro;sin datos;1;sin datos;1991.;7887
Dibujo de máquinas.;Laudien, Karl;sin datos;1;sin datos;1945.;7888
Dibujo de máquinas :;Schiffner, Ricardo;con iniciación en la construcción mecánica.;1;3a ed.;1943.;7889
Prospección y cubicación de los Yacimientos de Placeres Auríficos.;Arias, Antonio Normando;sin datos;1;sin datos;1968.;7890
Mining engineer's handbook.;Peele, Robert;sin datos;4;3rd ed.;1941.;7891
El cálculo electrónico.;Renard, Bruno;sin datos;1;sin datos;1963.;7892
Mining engineer's handbook.;Peele, Robert;sin datos;4;3rd ed.;1941.;7893
Tratado de laboreo de minas :;Heise, F;con especial consideración de las minas de carbón.;7;sin datos;1943.;7894
Tratado de laboreo de minas :;Heise, F;con especial consideración de las minas de carbón.;5;sin datos;1943.;7895
Compendio de laboreo de minas.;Heise, F;sin datos;4;sin datos;1948.;7896
Prospección, exploración y evaluación.;Novitzky, Alejandro;sin datos;1;sin datos;1978.;7897
Minería a cielo abierto y su planificación.;Novitzky, Alejandro;sin datos;2;sin datos;1976.;7898
Electrotecnia I.;Renaud, Adolfo Jorge;sin datos;5;6a ed.;1984.;7899
Electrotecnia II.;Renaud, Adolfo Jorge;sin datos;6;1a ed.;1981.;7900
Mining practice.;sin datos;sin datos;1;sin datos;1946.;7901
Manual práctico del buscador de minas.;Cassano, Ricardo;sin datos;2;sin datos;[19--];7902
Economía minera.;Hoover, Theodore Jesse;sin datos;8;sin datos;1946.;7903
Manual del minero.;Camargo Blacutt, Carlos;sin datos;2;1a ed.;1941.;7904
Tratamiento mecánico de minerales.;Zuleta, Mario;sin datos;1;1a ed.;1994.;7905
Seguridad e higiene industrial.;Dembo, A;sin datos;15;sin datos;1968.;7906
Manual del constructor de máquinas.;Dubbel, H;sin datos;1;2a ed.;1952.;7907
Manual del constructor de máquinas.;Dubbel, H;sin datos;1;2a ed.;1952.;7908
Electrónica general :;Gil Padilla, Antonio J;dispositivos básicos y analógicos.;1;sin datos;1990.;7909
El hormigón armado :;Saliger, Rudolf;materiales, cálculo y formas constructivas.;1;2a ed.;l953.;7910
Higiene y seguridad industrial.;Dembo, A;sin datos;1;13a ed.;1981.;7911
Seguridad e higiene industrial.;Dembo, A;sin datos;2;4a ed., rev. y ampliada;[19--];7912
Seguridad e higiene industrial.;Dembo, A;sin datos;2;8a ed.;1981.;7913
Seguridad e higiene industrial.;Tusiani, Mario Oscar;sin datos;1;sin datos;1969.;7914
Practical mine development and equipment.;Eaton, Lucien;sin datos;1;1st ed.;1934.;7915
Handbook for prospectors and operators of small mines.;Bernewitz, M. W. Von;sin datos;1;4th ed.;1943.;7916
Cumbres borrascosas.;Brönte, Emily;sin datos;1;sin datos;2000.;7917
Yacimientos minerales de rendimiento económico.;Bateman, Alan M;sin datos;6;5a ed.;1978.;7918
Recursos minerales de la República Argentina :;Ángelelli, Víctorio;yacimientos metalíferos.;3;sin datos;1950.;7919
Recursos minerales de la República Argentina :;Borrello, Ángel V;combustibles sólidos minerales.;1;sin datos;1956.;7920
Las especies minerales de la República Argentina.;Ahlfeld, Federico;sin datos;2;sin datos;1948.;7921
Preparación mecánica de minerales y carbones.;Fernández Miranda y Gutiérrez, Eustaquio;sin datos;5;sin datos;1946.;7922
Handbook of mineral dressing :;sin datos;Ores and industrial minerals.;1;sin datos;1945.;7923
Explotación de minas ;Vidal, V;Tomo III Métodos, energía, servicios del exterior.;1;sin datos;1966.;7924
Mine examination, questions and answers.;Beard, James T;sin datos;1;1st ed.;1923.;7925
Mine examination, questions and answers.;Beard, James T;sin datos;1;1st ed.;1923.;7926
Mine examination, questions and answers.;Beard, James T;sin datos;1;1st ed.;1923.;7927
Elementos de minería.;Young, George J;sin datos;4;sin datos;[19--];7928
Código de Minería de la República Argentina.;sin datos;sin datos;3;sin datos;2002.;7929
Código de Minería de la República Argentina.;sin datos;sin datos;3;sin datos;1981.;7930
Código de Minería de la República Argentina.;sin datos;sin datos;6;1a ed.;1980.;7931
Código de Minería de la República Argentina.;sin datos;sin datos;1;7a ed.;1980.;7932
Contribución al conocimiento de la minería y geología del Noroeste Argentino.;Sgrosso, Pascual;sin datos;1;sin datos;1943.;7933
The Design of Mine Structures.;Ketchum, Milo S;sin datos;1;11th ed.;1912.;7934
Yacimientos metalíferos de la República Argentina I.;Ángelelli, Víctorio;sin datos;1;sin datos;1984.;7935
Yacimientos metalíferos de la República Argentina II.;Ángelelli, Víctorio;sin datos;1;sin datos;1984.;7936
Curso de máquinas mineras.;Ariñez, Marino Antonio;sin datos;2;sin datos;1981.;7937
Curso medio de resistencia de materiales.;Panseri, Enrique;sin datos;2;9a ed.;1981.;7938
Higiene.;Fernández Riera, Serafín;sin datos;2;1a ed.;1941.;7939
Evaluación de microclimas laborales.;sin datos;sin datos;2;sin datos;1980.;7940
Estudio de las condiciones de higiene del aire de la ciudad de Buenos Aires.;Marsico, Alfredo;sin datos;6;sin datos;1974.;7941
Elementos y práctica de ingenieria eléctrica.;Avendaño, J;sin datos;1;sin datos;[19--];7942
Radioisótopos :;Faires, R. A;técnicas de laboratorio.;1;sin datos;1973.;7943
Manual de procedimientos modernos para las investigaciones de tesoros y minas.;Iglesias, Janeiro J;sin datos;1;2a ed., corr. y aum.;1939.;7944
Curso metódico de dibujo de máquinas.;Carrino, Reynaldo P;sin datos;1;sin datos;1944.;7945
Curso de explotación de minas del Programa de Asistencia y Cooperación técnica :;Ibarra, Luis Eduardo;creación de un laboratorio piloto en la formación de recursos humanos.;2;sin datos;1981.;7946
Técnica experimental en las riquezas minerales argentinas :;Guiñazú, Ricardo;importancia, antecedentes, caracteres geológicos, investigaciones prácticas.;3;sin datos;1943.;7947
Canteras y minas.;Bertolio, S;sin datos;2;sin datos;1992.;7948
Perforaciones y sondeos :;Cambefort, Henri;su empleo en los trabajos de reconocimiento y en las obras públicas.;2;3a ed.;1975.;7949
Código de Minería.;sin datos;sin datos;11;sin datos;1998.;7950
Curso de derecho minero.;Catalano, Edmundo Fernando;sin datos;1;4a ed., actualizada;1975.;7951
Problemas emergenciales y soluciones APELL.;Villas Boas, Roberto ;sin datos;1;sin datos;2004.;7952
La metamorfosis.;Kafka, Franz;sin datos;2;sin datos;2000.;7953
Venecia.;Accame, Jorge;sin datos;2;2a ed.;1999.;7954
La vida de la abejita Bina.;Díaz Michel, Mery Ruth;sin datos;2;1a ed.;2004.;7955
El príncipe rana.;Mitchell, Stephen;sin datos;1;1a ed.;1999.;7956
Ciencias naturales activa 7 :;Carreras, Norma ;geología-biología-física-química.;4;1a ed.;2001.;7957
Ciencias naturales activa 8 :;Carreras, Norma ;geología-biología-física-química.;4;1a ed.;2003.;7958
Ciencias naturales 9 :;Carreras, Norma ;geología-biología-física-química.;4;1a ed.;2001.;7959
Reglamento de básquetbol.;sin datos;sin datos;1;sin datos;2009.;7960
Reglamento de hándball :;sin datos;2003-2004.;6;1a ed.;2003.;7961
Léxico técnico de las artes plásticas.;Crespi, Irene;sin datos;1;1a ed.;1971.;7962
Tesis, monografías e informes.;Botta, Mirta;sin datos;8;1a ed.;2002.;7963
El viejo y el mar.;Hemingway, Ernest;sin datos;4;sin datos;2003.;7964
Despacio, escuela :;Fernández Tiscornia, Nelly;la vida empieza con A.;3;sin datos;1999.;7965
Reglamento de b?asquetbol.;sin datos;sin datos;5;sin datos;2004.;7966
Literatura 3 argentina y latinoamericana y lengua.;Galán, Ana Silvia;sin datos;3;sin datos;2001.;7967
Biología activa.;Bombara, Nora;sin datos;3;sin datos;2001.;7968
Literatura argentina y latinoamericana.;De Luca, Gabriel ;sin datos;3;sin datos;1998.;7969
Lengua 9.;Bavio, Carmen;sin datos;3;sin datos;2004.;7970
Ciencias naturales 7 :;Espinoza, Ana María;tercer ciclo EGB.;2;sin datos;2003.;7971
Ciencias naturales 8 :;Espinoza, Ana María;tercer ciclo EGB.;2;sin datos;2003.;7972
Ciencias Naturales 9.;Espinoza, Ana María;sin datos;2;sin datos;2003.;7973
Biología 1 :;Suárez, Hilda;la célula: unidad de los seres vivos.;2;sin datos;2002.;7974
Biología 2 :;Suárez, Hilda;el organismo humano: funciones de nutrición, relación y control.;2;sin datos;2002.;7975
Biología 3 :;Suárez, Hilda;el organismo humano: salud y enfermedad.;2;sin datos;2002.;7976
Biología 4 :;Frid, Débora;la vida: continuidad y cambio.;2;sin datos;2002.;7977
El ecosistema y la preservación del ambiente.;Muzzanti, Silvina;sin datos;2;sin datos;2002.;7978
Matemática 7 :;Agrasar, Mónica;Anexo Teórico + Trabajos Prácticos.;3;sin datos;2003.;7979
Matemática 8 :;Agrasar, Mónica;Anexo Teórico + Trabajos Prácticos.;3;sin datos;2003.;7980
Matemática 9 :;Agrasar, Mónica;Anexo Teórico + Trabajos Prácticos.;3;sin datos;2003.;7981
Físico-Química :;Bosack, Alejandro P;Activa.;3;sin datos;2001.;7982
Culturas y estéticas contemporáneas.;Ferreras, Cristina;sin datos;1;sin datos;2003.;7983
Lengua y Literatura 7 :;Blake, Cristina Elsa;la narración en la literatura y en los discursos sociales.;3;sin datos;2002.;7984
Antología :;Bavio, Carmen;textos literarios y no literarios.;3;sin datos;2004.;7985
La gesta de Patagones.;García Enciso, Isaías José;sin datos;1;3a ed.;1977.;7986
Drogadependencia :;Ronchetti, María Inés;su prevención.;1;sin datos;1995.;7987
Fin de fiesta.;Guido, Beatriz;sin datos;1;sin datos;2000.;7988
Nacimiento de una Ciudad Romana :;Macaulay, David;300 años a.de J.C.;1;sin datos;1978.;7989
Veinte poemas de amor y una canción desesperada.;Neruda, Pablo;sin datos;2;14a ed.;1992.;7990
Geografía de la Argentina.;Lorenzini, Horacio N;sin datos;6;4a ed.;1995.;7991
Geografía de la Argentina.;Lorenzini, Horacio N;sin datos;2;6a ed.;1993.;7992
Manual de Normas Iram de aplicación para Dibujo Técnico.;sin datos;sin datos;1;26a ed.;1995.;7993
Anatomía y fisiología :;Dembo, A;estudio del cuerpo humano.;2;18a ed.;1976.;7994
Manual de Normas para Dibujo Técnico.;sin datos;sin datos;2;27a ed.;1989.;7995
Curso de anatomía y fisiología :;Dembo, A;estudio del cuerpo humano.;1;12a ed.;[19--];7996
Aritmética 3.;Repetto, Celina H;sin datos;3;17a ed.;1968.;7997
Matemática preuniversitaria.;Royo De Ovando, Josefina;sin datos;1;sin datos;2004.;7998
Lexis 22 :;sin datos;diccionario enciclopédico VOX.;1;sin datos;1976.;7999
1890 ejercicios de álgebra primer curso.;Médici, S. Héctor ;sin datos;1;sin datos;[19--];8000
Elementos de trigonometría y esférica.;Alzaa, Fidencio;sin datos;1;11a ed.;1956.;8001
Matemática :;Tajani, Miguel M;enfoque moderno para Escuelas Nacionales de Educación Técnica Segundo año.;2;25a ed.;[19--];8002
Enseñar a pensar.;Márquez, Cristina del C;sin datos;1;sin datos;1985.;8003
Introducción al cálculo de probabilidades.;Gnedenko, B. V;sin datos;1;sin datos;1962.;8004
El riego :;Domínguez García-Tejero, Francisco;su implantación y su técnica.;1;sin datos;1971.;8005
Tratado popular de física.;Kleiber, Juan ;sin datos;1;4a ed.;1926.;8006
Teledetección aplicada :;Scanvic, Jean-Yves ;cartografía.;1;sin datos;1989.;8007
G.P.S. :;Nuñez-García Del Pozo, Alfonso;la nueva era de la topografía.;1;sin datos;1992.;8008
Historia universal :;sin datos;prehistoria y primeras civilizaciones.;1;sin datos;2004.;8009
Historia universal :;sin datos;Alejandro y el mundo griego.;1;sin datos;2004.;8010
Historia universal :;sin datos;Asirios, Persas y Primeras Culturas Americanas.;1;sin datos;2004.;8011
Química inorgánica moderna.;Parkes, G. D;sin datos;1;5a ed., rev. y ampliada;1955.;8012
Historia universal :;sin datos;el Egipto Faraónico.;1;sin datos;2004.;8013
Hierro y acero.;Tiemann, Hugh P;sin datos;1;sin datos;1950.;8014
El petróleo argentino.;Silenzi De Stagni, Adolfo;sin datos;1;4a ed.;1955.;8015
Glosario de términos usuales de la industria petrolera.;sin datos;sin datos;1;sin datos;1947.;8016
Un árbol, sus ramas... sus frutos...;Belaunde, Enrique Ricardo;sin datos;4;sin datos;1997.;8017
Para entender el cambio climático.;sin datos;sin datos;5;1a ed.;2004.;8018
LENGUA 8 EGB3.;Cano, Fernanda;sin datos;5;1a ed.;2005.;8019
LENGUA 9 EGB 3.;Campos, Agustina;sin datos;6;sin datos;2005.;8020
AutoCAD 2000 :;sin datos;User's Guide.;1;sin datos;2000.;8021
Matemática 9 EGB3.;sin datos;sin datos;5;sin datos;2005.;8022
Matemática 8 EGB3.;Aurucis, Patricia Inés;sin datos;6;sin datos;2005.;8023
Ciencias Sociales 8 EGB3.;sin datos;sin datos;6;1a ed.;2005.;8024
Ciencias Sociales 7 EGB3.;sin datos;sin datos;5;sin datos;2005.;8025
Ciencias Naturales 8 EGB3.;Abellan, Karina;sin datos;11;1a ed.;2005.;8026
Ciencias Naturales 7 EGB3.;Caro, Gabriela;sin datos;5;sin datos;2005.;8027
Lecturas para estudiantes 8o. año EGB :;sin datos;leer por leer.;12;sin datos;2004.;8028
Lecturas para estudiantes 2.;sin datos;sin datos;12;sin datos;2004.;8029
Lecturas para estudiantes 3 :;sin datos;leer por leer.;12;sin datos;2004.;8030
Lecturas para estudiantes 4 :;sin datos;leer por leer.;12;sin datos;2004.;8031
CIENCIAS NATURALES 9 EGB 3.;Bazán, Marcelo Darío;sin datos;5;sin datos;2005.;8032
Lecturas para estudiantes 5 :;sin datos;leer por leer.;12;sin datos;2004.;8033
Harry Potter y la piedra filosofal.;Rowling, J. K;sin datos;1;sin datos;2004.;8034
El visitante.;Maritano, Alma;sin datos;9;1a ed.;1998.;8035
Anatomía y fisiología del sistema nervioso.;Dos Santos Lara, José Ángel;sin datos;1;19a ed.;1976.;8036
La jaula vacía.;Villafuerte, Carlos;sin datos;1;14a ed.;1973.;8037
Platero y yo.;Jiménez, Juan Ramón;sin datos;1;2a ed.;1981.;8038
New Let's Go for EGB! :;Elsworth, Steve;student's Book.;1;sin datos;2000.;8039
Let's Go for EGB!;Elsworth, Steve;sin datos;1;sin datos;1996.;8040
Demografía y empleo.;sin datos;sin datos;1;sin datos;2000.;8041
Reglamento de hándball.;sin datos;sin datos;3;sin datos;2005.;8042
Inalterable documento.;Wilke, F. Ludwig;sin datos;1;sin datos;[19--];8043
LENGUA 8.;Marín, Marta;sin datos;1;2a ed.;1997.;8044
Platero y yo.;Jiménez, Juan Ramón;sin datos;1;5a ed.;1980.;8045
Un crimen secundario.;Birmajer, Marcelo;sin datos;4;sin datos;1994.;8046
Historia universal :;sin datos;el Imperio Romano.;1;sin datos;2004.;8047
Historia universal :;sin datos;China y el Extremo Oriente.;1;sin datos;2004.;8048
Historia universal :;sin datos;Europa Medieval.;1;sin datos;2004.;8049
Historia universal :;sin datos;Mongoles y Nuevos Reinos Islámicos.;1;sin datos;2004.;8050
Integración regional y asimetrías económicas.;Quintana, Humberto Leopoldo;sin datos;1;sin datos;1997.;8051
Notas y apuntes sobre Sistema de Posicionamiento Global (Navstar).;sin datos;sin datos;1;sin datos;1995.;8052
Curso de capacitación y entrenamiento :;sin datos;Sistema Navstar GPS.;1;sin datos;1997.;8053
Incra Monograph 1 The Metallurgy of Copper :;Hultgren, Ralph;Selected Thermodynamic values and phase diagrams for Copper and some of its binary alloys.;1;sin datos;1971.;8054
Diffusion rate data and mass transport phenomena for Copper Systems.;Butrymowicz, Daniel B;sin datos;1;sin datos;1977.;8055
E/MJ Operating Handbook of Mineral Processing.;Thomas, Richard;sin datos;1;sin datos;1977.;8056
Historia universal :;sin datos;Aztecas, Mayas e Incas.;1;sin datos;2004.;8057
Fábulas andinas.;Willka, Wanka;sin datos;2;sin datos;1999.;8058
Ñawpamanta Kunanman.;sin datos;sin datos;1;sin datos;2004.;8059
Churqui Wayqo.;Willka, Wanka;sin datos;1;sin datos;2004.;8060
Biología 1.;Zarur, Pedro;sin datos;4;14a ed.;1981.;8061
Biología 1.;Liserre de Telechea, María A;sin datos;3;sin datos;1994.;8062
Biología 1.;González, Adrián R;sin datos;3;sin datos;1994.;8063
Biología 1 :;Zarur, Pedro;los organismos vivientes y su ambiente.;2;24a ed.;1990.;8064
Biología 1 :;Zarur, Pedro;los organismos vivientes y su ambiente.;1;25a ed.;1990.;8065
Biología 1.;Zarur, Pedro;sin datos;1;15a ed.;1984.;8066
Biología.;Dos Santos Lara, José Ángel;sin datos;1;sin datos;1967.;8067
Biología.;Pasquali, Luis A;sin datos;3;5a ed.;[19--];8068
Ciencias Naturales 7 EGB 3 :;Mateu, Marina;biología.;1;sin datos;1997.;8069
Biología 1 :;Aljanati, David;la vida en la Tierra.;1;1a ed.;1995.;8070
Biología 1 :;Botto, Juan L;los seres vivos y su ambiente.;1;2a ed.;1980.;8071
Biología 1 :;Botto, Juan L;los seres vivos y su ambiente.;1;la ed.;1979.;8072
Biología 1.;Vattuone, Lucy F. de;sin datos;1;9a ed.;1984.;8073
Biología 1.;Vattuone, Lucy F. de;sin datos;1;la ed.;1979.;8074
Biología 2 :;Zarur, Pedro;la diversidad de formas y unidad de patrones en los seres vivos.;1;1a ed.;1980.;8075
Naturaleza y propiedades de los suelos.;Buckman, Harry;sin datos;1;1a ed.;l966.;8076
Biología 2 :;Zarur, Pedro;la diversidad de formas y unidad de patrones en los seres vivos.;2;11a ed.;1985.;8077
Biología 2 :;Zarur, Pedro;la diversidad de formas y unidad de patrones en los seres vivos.;1;10a ed.;1981.;8078
Biología 2.;Zarur, Pedro;sin datos;2;7a ed.;1981.;8079
Historia universal :;sin datos;nuevas potencias y Repúblicas Americanas.;1;sin datos;2004.;8080
Historia universal :;sin datos;la época de los Grandes Descubrimientos.;1;sin datos;2004.;8081
Historia universal :;sin datos;América Colonial y Monarquías Absolutas.;1;sin datos;2004.;8082
Historia universal :;sin datos;el Expansionismo Europeo.;1;sin datos;2004.;8083
Historia universal :;sin datos;la era de las revoluciones.;1;sin datos;2004.;8084
Historia universal :;sin datos;capitalismo e imperialismo.;1;sin datos;2004.;8085
