Titulo_Libro;Autor;Subtitulo_Libro;Cantidad_Ejemplares;Edicion;Año_Publicacion;Item_Number
Manual de derecho civil y comercial.;Messineo, Francesco;sin datos;1;1ra.ed.;1956.;5298
Manual de derecho civil y comercial.;Messineo, Francesco;sin datos;1;1ra.ed.;1956.;5299
Manual de derecho civil y comercial.;Messineo, Francesco;sin datos;1;1ra.ed.;1954.;5300
Código Civil de la República Argentina y leyes complementarias.;sin datos;sin datos;2;1ra.ed.;1960.;5301
Derecho procesal civil : ;Fernandez, Raymundo L.;código de procedimiento civil comentado.;1;1ra.ed.;1955.;5302
Derecho procesal civil : ;Fernandez, Raymundo L.;procedimientos especiales.;2;1ra.ed.;1955.;5303
Código de procedimientos en lo civil y comercial.;sin datos;sin datos;1;4ta.ed.;1959.;5304
Principios de derecho civil.;Agliano, Humberto;sin datos;2;1ra.ed.;s.f..;5305
Estudio de las obligaciones en nuestro derecho civil.;Rezzonico, Luis María;sin datos;1;9na.ed.;1961.;5306
Estudio de las obligaciones en nuestro derecho civil.;Rezzonico, Luis María;sin datos;1;9na.ed.;1961.;5307
Estudio de las obligaciones en nuestro derecho civil.;Rezzonico, Luis María;sin datos;1;8va.ed.;1957.;5308
Estudio de los contratos en nuestro derecho civil.;Rezzonico, Luis María;sin datos;1;2da.ed.;1958.;5309
Estudio de los contratos en nuestro derecho civil.;Rezzonico, Luis María;sin datos;1;2da.ed.;1959.;5310
Escritos sobre aprendizaje : ;Echeverría, Rafael;recopilación.;2;1ra.ed.;2010.;5311
América latina frente a la crisis.;Kliksberg, Bernardo;sin datos;2;1ra.ed.;2011.;5312
Los orígenes culturales de la cognición humana.;Tomasello, Michael;sin datos;1;1ra.ed.;2007.;5313
Tratado teórico práctico de las asociaciones.;Páez, Juan L;sin datos;1;3ra.ed.;1964.;5314
La conclusión del contrato de seguro.;Colautti, Carlos E.;sin datos;1;1ra.ed.;1955.;5315
Capitalización de hacienda.;Adrogue, Manuel Ignacio;sin datos;2;1ra.ed.;1970.;5316
Notas al código procesal civil de la provincia de Jujuy.;sin datos;sin datos;2;1ra.ed.;1968.;5317
Consecuencias de la Reforma Civil en la Legislación Mercantil Argentina.;Cornejo Costas, Emilio;sin datos;1;1ra.ed.;s.f..;5318
Reformas al código civil : ;sin datos;ley17711.;1;1ra.ed.;1968.;5319
La inmediación en el proceso.;Eisner, Isidoro;sin datos;1;1ra.ed.;1963.;5320
Curso inicial de derecho privado.;Rocca, Ival;sin datos;1;1ra.ed.;1967.;5321
Manual de derecho privado : ;Cabrera Y Quiroga, Guillermo;cuarto curso.;1;1ra.ed.;s.f..;5322
Derecho privado usual.;Rocca, Ival;sin datos;1;1ra.ed.;1967.;5323
Arrendamientos y aparcerías rurales.;Blasco, Omar Emilio;sin datos;1;1ra.ed.;1963.;5324
Obligaciones de dinero y depreciación monetaria.;Trigo Represas, Felix A.;sin datos;1;1ra.ed.;1965.;5325
Legitimacion de hijos extramatrimoniales.;López Del Carril, Julio J;sin datos;1;1ra.ed.;1960.;5326
El derecho privado patrio en la legislación de Jujuy.;Sánchez De Bustamante, Teófilo;sin datos;1;1ra.ed.;1958.;5327
La justicia emplazada a reformarse.;Vanderbilt, Arthur T;sin datos;1;1ra.ed.;1959.;5328
Derecho de retención.;Vásquez, Alejandro A;sin datos;1;2da.ed.;1962.;5329
Código penal anotado.;Oderigo, Mario A;sin datos;1;3ra.ed.;1962.;5330
La dinámica del delito.;Altavilla, Enrico;sin datos;1;1ra.ed.;1962.;5331
Derecho internacional, comercio y finanzas.;Metzger, Stanley D;sin datos;1;1ra.ed.;1962.;5332
Derecho sindical y corporativo.;Cabanellas, Guillermo;sin datos;2;1ra.ed.;1959.;5333
Introducción al derecho laboral.;Cabanellas, Guillermo;sin datos;1;1ra.ed.;1960.;5334
Introducción al derecho laboral.;Cabanellas, Guillermo;sin datos;1;1ra.ed.;1960.;5335
Derecho del trabajo : ;Cabanellas, Guillermo;parte general.;1;1ra.ed.;1963.;5336
Derecho del trabajo : ;Cabanellas, Guillermo;parte general.;1;1ra.ed.;1963.;5337
Derecho del trabajo : ;Cabanellas, Guillermo;parte general.;1;1ra.ed.;1964.;5338
Derecho del trabajo : ;Cabanellas, Guillermo;parte especial.;1;1ra.ed.;1964.;5339
La dinámica del delito : ;Altavilla, Enrico;parte general.;1;1ra.ed.;1961.;5340
Compendio de derecho laboral.;Cabanellas, Guillermo;sin datos;1;1ra.ed.;1968.;5341
Compendio de derecho del trabajo.;Cabanellas, Guillermo;sin datos;1;1ra.ed.;1968.;5342
Derecho normativo laboral.;Cabanellas, Guillermo;sin datos;1;1ra.ed.;1966.;5343
Derecho de los conflictos laborales.;Cabanellas, Guillermo;sin datos;1;1ra.ed.;1966.;5344
Leyes usuales del trabajo.;Colotti, Julio E;sin datos;2;3ra.ed.;1963.;5345
Leyes usuales del trabajo.;Colotti, Julio E;sin datos;2;4ta.ed.;1966.;5346
Derecho de la previsión social : ;Goñi Moreno, José María;parte general.;1;1ra.ed.;1956.;5347
Derecho de la previsión social : ;Goñi Moreno, José María;parte especial.;1;1ra.ed.;1956.;5348
Leyes de trabajo anotadas.;Rivas, José María;sin datos;1;1ra.ed.;1969.;5349
Las relaciones laborales en la empresa.;Rivas, José María;sin datos;1;1ra.ed.;1964.;5350
Reparación de los infortunios del trabajo.;Somare, José Isidro;sin datos;1;1ra.ed.;1949.;5351
Procedimiento laboral.;Jofre, Pio S;sin datos;1;1ra.ed.;1964.;5352
Evolución de la legislación nacional del trabajo.;Ruprecht, Alfredo J;sin datos;1;1ra.ed.;1951.;5353
Legislación laboral y contabilidad.;Martín, Miguel Ángel;sin datos;2;1ra.ed.;1964.;5354
Leyes del trabajo actualizadas.;sin datos;sin datos;1;1ra.ed.;s.f..;5355
Legislación del trabajo.;Sylvester, Hugo L;sin datos;3;15ta.ed.;1966.;5356
Legislación de la construcción y del trabajo.;Sanchez, Pedro C.;sin datos;1;1ra.ed.;1968.;5357
Viajantes de comercio.;Ruprecht, Alfredo J.;sin datos;1;1ra.ed.;1960.;5358
Tratado práctico de derecho del trabajo.;Krotoschin, Ernesto;sin datos;1;2da.ed.;1962.;5359
Tratado práctico de derecho del trabajo.;Krotoschin, Ernesto;sin datos;1;2da.ed.;1962.;5360
Tratado práctico de derecho del trabajo : ;Krotoschin, Ernesto;suplemento de actualización a junio de 1965.;1;1ra.ed.;1965.;5361
Jornada de trabajo.;Despontin, Luis Alberto;sin datos;1;1ra.ed.;1952.;5362
Jornada de trabajo.;Despontin, Luis Alberto;sin datos;1;1ra.ed.;1952.;5363
Manual teórico práctico de derecho del trabajo.;Pozzo, Juan M.;sin datos;4;1ra.ed.;1961.;5364
Manual teórico práctico de derecho del trabajo.;Pozzo, Juan M.;sin datos;4;1ra.ed.;1961.;5365
Derecho mexicano del trabajo.;Cueva, Mario De La;sin datos;1;5ta.ed.;1960.;5366
Manual teórico práctico de derecho del trabajo.;Pozzo, Juan M.;sin datos;1;3ra.ed.;1960.;5367
Código del trabajo anotado : ;Krotoschin, Ernesto;suplemento.;2;1ra.ed.;1965.;5368
El preaviso en el derecho del trabajo.;Russomano, Mozart Víctor;sin datos;1;1ra.ed.;1965.;5369
Lineamientos de derecho del trabajo.;Deveali, Mario L.;sin datos;1;3ra.ed.;1956.;5370
Manual de derecho del trabajo y previsión social.;Rodríguez Prieto, Jorge E;sin datos;1;1ra.ed.;s.f..;5371
Manual de derecho del trabajo y previsión social.;Rodríguez Prieto, Jorge E;sin datos;1;1ra.ed.;s.f..;5372
Regimen del trabajo rural : ;Sylvester, Hugo L.;recopilación ordenada de leyes, decretos y resoluciones.;1;2da.ed.;1951.;5373
Subsidios familiares : ;sin datos;régimen legal.;1;1ra.ed.;1967.;5374
Curso de legislación del trabajo.;Sánchez, Pedro C;sin datos;1;1ra.ed.;1954.;5375
Régimen de jubilaciones y pensiones para empleados de comercio.;sin datos;sin datos;1;1ra.ed.;1965.;5376
Curso de derecho del trabajo.;Pérez Botija, Eugenio;sin datos;1;6ta.ed.;1960.;5377
Economía laboral moderna.;Davis, Pearce;sin datos;3;1ra.ed.;1954.;5378
Ordenamiento de las leyes obreras argentinas.;Unsain, Alejandro M;sin datos;1;1ra.ed.;1947.;5379
Derecho comercial.;Taboada, Antonio A.;sin datos;1;1ra.ed.;1955.;5380
Derecho comercial.;Taboada, Antonio A.;sin datos;1;1ra.ed.;1955.;5381
Tratado elemental de derecho comercial.;Malagarriga, Carlos C;sin datos;1;1ra.ed.;1958.;5382
Tratado elemental de derecho comercial.;Malagarriga, Carlos C;sin datos;2;2da.ed.;1958.;5383
Tratado elemental de derecho comercial.;Malagarriga, Carlos C;sin datos;1;2da.ed.;1958.;5384
Tratado elemental de derecho comercial.;Malagarriga, Carlos C;sin datos;2;2da.ed.;1958.;5385
Código de comercio y leyes complementarias anotados.;Alconada Aramburu, Carlos R.S.;sin datos;1;1ra.ed.;1961.;5386
Código de comercio y leyes complementarias anotados.;Alconada Aramburu, Carlos R.S.;sin datos;2;1ra.ed.;1961.;5387
Código de comercio y leyes complementarias anotados.;Alconada Aramburu, Carlos R.S.;sin datos;1;1ra.ed.;1961.;5388
Curso de derecho comercial.;Castillo, Ramón S;sin datos;3;10ma.ed.;1961.;5389
Curso de derecho comercial.;Castillo, Ramón S;sin datos;3;10ma.ed.;1961.;5390
Curso de derecho comercial.;Castillo, Ramón S;sin datos;3;10ma.ed.;1961.;5391
Código de comercio de la República Argentina comentado.;Fernandez, Raymundo L.;sin datos;1;1ra.ed.;1957.;5392
Derecho comercial : ;Garo, Francisco J;parte general.;1;1ra.ed.;1955.;5393
Derecho comercial : ;Garo, Francisco J;compraventas.;1;1ra.ed.;1956.;5394
Deuda externa un dibujo Argentino : ;Saravia, Federico;cuatro experiencias de divulgación.;7;1ra.ed.;2011.;5395
Lecturas de contabilidad básica.;Simaro, Jorge D;sin datos;1;1ra.ed.;2012.;5396
Producto geográfico por comunas.;sin datos;sin datos;1;1ra.ed.;2012.;5397
El concordato y la quiebra.;Garcia Martínez, Francisco;sin datos;1;4ta.ed.;1962.;5398
El concordato y la quiebra.;Garcia Martínez, Francisco;sin datos;1;4ta.ed.;1962.;5399
El concordato y la quiebra.;Garcia Martínez, Francisco;sin datos;1;4ta.ed.;1962.;5400
Ley de quiebras.;Sajon, Jaime V.;sin datos;2;1ra.ed.;1962.;5401
Quiebra y tributos : ;Tarantino, Jacinto R;proyección de la quiebra en el derecho tributario.;1;1ra.ed.;1961.;5402
Estados contables y libros de comercio.;Verón, Alberto Víctor;sin datos;2;2da.ed.;1978.;5403
El procedimiento en la quiebra.;Migliardi, Francisco N. M. O;sin datos;1;1ra.ed.;1966.;5404
Principios de derecho marítimo.;Diez Mieres, Alberto;sin datos;1;1ra.ed.;1951.;5405
El crédito en el derecho.;Koch, Arwed;sin datos;1;1ra.ed.;1946.;5406
Reformas al código de comercio.;Bergel, Salvador D.;sin datos;1;1ra.ed.;1965.;5407
Cuestiones de derecho comercial.;Fargosi, Horacio P.;sin datos;1;1ra.ed.;1965.;5408
Código de comercio.;sin datos;sin datos;1;29na.ed.;1959.;5409
Código de comercio.;sin datos;sin datos;2;32da.ed.;1963.;5410
Derecho económico : ;Olivera, Julio H. G;conceptos y problemas fundamentales.;1;1ra.ed.;1954.;5411
El establecimiento comercial.;Supervielle, Bernard;sin datos;1;1ra.ed.;1953.;5412
El impuesto a los réditos : ;Reig, Enrique Jorge;estudio teórico práctico del gravamen argentino, dentro de la teoría general del impuesto.;2;1ra.ed.;1961.;5413
Teoría general del instrumento público : ;González, Carlos Emerito;introducción al derecho notarial argentino y comparado.;1;1ra.ed.;1953.;5414
Las cláusulas económico-sociales en las constituciones de América.;sin datos;sin datos;1;1ra.ed.;1947.;5415
Las instituciones de la constitución argentina.;Arce, José;sin datos;1;1ra.ed.;1963.;5416
Bases y puntos de partida para la Organización Política de la República Argentina.;Alberdi, Juan Bautista,;sin datos;1;1ra.ed.;1957.;5417
Tratado de la ciencia del derecho constitucional argentino y comparado.;Linares Quintana, Segundo V;sin datos;1;1ra.ed.;1956.;5418
Tratado de la ciencia del derecho constitucional argentino y comparado.;Linares Quintana, Segundo V.;sin datos;1;1ra.ed.;1956.;5419
Tratado de la ciencia del derecho constitucional argentino y comparado.;Linares Quintana, Segundo V;sin datos;1;1ra.ed.;1956.;5420
Tratado de la ciencia del derecho constitucional argentino y comparado.;Linares Quintana, Segundo V;sin datos;1;1ra.ed.;1956.;5421
Cálculo diferencial e integral I : ;Espinosa Herrera, Ernesto Javier;problemas resueltos.;2;1ra.ed.;2008.;5422
Contratos civiles y comerciales : ;Stiglitz, Rubén S.;parte general.;4;2da.ed.;2010.;5423
Contratos civiles y comerciales : ;Stiglitz, Rubén S.;parte general.;4;2da.ed.;2010.;5424
Rumbos de la comunidad humana.;Niebuhr, Reinhold;sin datos;1;1a.e.d.;1964.;5425
Política económica argentina.;sin datos;sin datos;1;1a.ed.;1969.;5426
Democratic Manifesto by Ferdinad Peroutka.;Berle, Adolf A.;sin datos;1;1a.e.d.;1959.;5427
The Economic of the American People : ;Gerbard, Colm;Progress,problems and prospects.;2;1a.ed.;1961.;5428
El desarrollo social de América Latina en la Postguerra.;Comisión Económica Para América Latina;sin datos;1;1a.ed.;1963.;5429
Problemas y perspectivas del desarrollo industrial Latinoamericano.;sin datos;sin datos;1;1a.ed.;1964.;5430
La ciencia de la economía politica.;George, Henry;sin datos;1;2a.ed.;1922.;5431
Year Book of Agricultural Co-operation 1947.;sin datos;sin datos;1;1a.ed.;1948.;5432
Business Executive's Handbook.;Brown, Stanley M.;sin datos;1;4a.ed.;1966.;5433
Estudio económico de América LAtina, 1963.;sin datos;sin datos;1;1a.ed.;1964.;5434
Sistema económico y rentístico de la Confederación Argentina según su constitución de 1853.;Alberdi, Juan Bautista;sin datos;1;1a.ed.;1921.;5435
Reunion Anual de la Asociación Argentina de Economía Política : ;sin datos;Tomo I.;1;1a.ed.;1976.;5436
Teoria y gestión de la balanza de4 pagos.;Guitian, Manuel;sin datos;1;1a.ed.;1976.;5437
Anales. XIII Reunión Anual : ;Asociación Argentina De Economía Política;Volumen I.;1;1a.ed.;1978.;5438
Anales. XIII Reunión Anual : ;sin datos;Tomo I.;1;1a.ed.;1980.;5439
Finanzas.;Weston, J. Fred;sin datos;1;1a.ed.;1979.;5440
Amercian Public Finace.;Shultz, William J;sin datos;1;8a.ed.;1965.;5441
The history and economics of transport.;Kirkaldy, Adam W.;sin datos;1;1a.ed.;1980.;5442
The history of milk prices : ;Cohen, Ruth L.;an analysis of the factors affecting the prices of milk and milk products.;1;1a.ed.;1936.;5443
Patterns of Economic Growth : ;Calderwood, James D;The American Experience.;1;1a.e.d.;s.d..;5444
Análisis económico de los recursos naturales.;Zapata, Juan Antonio;sin datos;1;1a.ed.;1982.;5445
Principios de macroeconomia.;Reynolds, Lloyd G.;sin datos;1;1a.ed.;1974.;5446
Ethics for an industrial Age A Christian Inquiry.;Obenhaus, Víctor;sin datos;1;1a.ed.;s.d..;5447
Oferta monetaria : ;Diz, Adolfo C.;Un modelo simple aplicable en América Laina.;1;1a.ed.;1975.;5448
Economía y sociedad.;Johnson, Harry G.;sin datos;1;1a.ed.;1979.;5449
Psicologia de la economía.;Katona, George;sin datos;1;1a.ed.;1979.;5450
Economia de la inflación.;Trevitnick, James A.;sin datos;1;1a.ed.;1979.;5451
Tratado de conomia politica.;Olozaga y Bustamante, José María de;sin datos;2;1a.ed.;1880.;5452
Estrategias para el desarrollo y modernizacion del eje metropolitano.;sin datos;sin datos;1;1a.ed.;1978.;5453
BAIRES 2.000 : ;sin datos;Desarrollo, modernización y cambio tecnológico.;1;1a.ed.;1978.;5454
La estrategia del desarrollo económico.;Hirschman, Albert O;sin datos;6;1a.ed.;1961.;5455
Desarrollo económico y político.;Jaguaribe, Helio;sin datos;6;1a.ed.;1973.;5456
El Subdesarrollo latinoamericano.;Daus, Federico A.;sin datos;3;2a.ed.;1976.;5457
Política económica general.;Serphin, Hans-Jürgen;sin datos;2;1a.ed.;1961.;5458
Economía matemática.;Allen, R.G.D.;sin datos;2;1a.ed.;1960.;5459
La estrategia del estado en el desarrollo financiero.;Genel, Julio Alfredo;sin datos;1;1a.ed.;1977.;5460
La demanda de dinero en los países en desarrollo el caso de Nicaragua.;Montealegre E., Eduardo;sin datos;2;1a.ed.;19783.;5461
Cooperación monetaria e ingtegracion económica en el mercado comun Centroamericano.;Lizano, Eduardo;sin datos;2;1a.ed.;1978.;5462
Diagnóstico de la estructura económica de la provincia de Buenos Aires.;sin datos;sin datos;1;1a.ed.;1978.;5463
Derecho constitucional de las nuevas provincias.;Linares Quintana, Segundo V;sin datos;1;1ra.ed.;1962.;5464
Derecho constitucional y administrativo : ;De Vedia, Agustín;instituciones de derecho público.;18;1ra.ed.;1969.;5465
Manual de derecho constitucional.;Sánchez Viamonte, Carlos;sin datos;8;4ta.ed.;1959.;5466
Derecho administrativo : ;Bielsa, Rafaél;legislación administrativa argentina.;1;3ra.ed.;1938.;5467
Derecho administrativo : ;Bielsa, Rafaél;legislación administrativa argentina.;1;3ra.ed.;1939.;5468
Compendio de derecho administrativo.;Bielsa, Rafaél;sin datos;1;3ra.ed.;1960.;5469
Curso de derecho constitucional.;Gonzalez Calderon, Juan A.;sin datos;1;3ra.ed.;s.f..;5470
Gobierno y administración de la República Argentina.;Linares Quintana, Segundo V;sin datos;6;2da.ed.;1959.;5471
Gobierno y administración de la República Argentina.;Linares Quintana, Segundo V.;sin datos;6;2da.ed.;1959.;5472
Derecho administrativo.;Sarria, Félix;sin datos;3;1ra.ed.;1961.;5473
Derecho administrativo de la economía : ;Gordillo, Agustín A;parte general.;1;1ra.ed.;1967.;5474
Instituciones de derecho público.;Viena, Raúl I;sin datos;1;1ra.ed.;s.f..;5475
Derecho político e historia de las ideas políticas.;Guido, Emilio;sin datos;1;3ra.ed.;1964.;5476
Críticas al regimen presupuestario argentino.;Matocq, Eugenio Andrés;sin datos;3;1ra.ed.;1962.;5477
Tratado de hacienda pública.;Gangemi, Lello;sin datos;1;1ra.ed.;1961.;5478
Principios de hacienda pública.;Franco, Gabriel;sin datos;2;1ra.ed.;1957.;5479
Manual de finanzas públicas.;Burato, Alfredo;sin datos;1;1ra.ed.;1967.;5480
Tratado de finanzas.;Gerloff, Wilhelm;sin datos;1;1ra.ed.;1961.;5481
Tratado de finanzas.;Gerloff, Wilhelm;sin datos;1;1ra.ed.;1961.;5482
Estudio sobre las finanzas argentinas.;Jarach, Dino;sin datos;1;1ra.ed.;1961.;5483
Finanzas.;Oria, Salvador;sin datos;2;1ra.ed.;1948.;5484
Finanzas.;Oria, Salvador;sin datos;2;1ra.ed.;1948.;5485
Finanzas.;Oria, Salvador;sin datos;2;1ra.ed.;1948.;5486
Principios de ciencia de las finanzas.;Griziotti, Benvenuto;sin datos;1;6ta.ed.;1959.;5487
Finanzas públicas e ingreso nacional.;Somers, Harold M;sin datos;9;2da.ed.;1961.;5488
Estudios financieros.;García Belsunce, Horacio A;sin datos;2;1ra.ed.;1966.;5489
Compendio de derecho público, constitucional, administrativo y fiscal.;Bielsa, Rafael;sin datos;1;1ra.ed.;1952.;5490
Impuesto sobre el gasto.;Gongora Galera, Facundo;sin datos;1;1ra.ed.;1960.;5491
Incentivos fiscales para el desarrollo industrial.;Heller, Jack;sin datos;1;1ra.ed.;1965.;5492
Tasas y exacciones parafiscales.;Fernández Bugallal y Barron, José Ramón;sin datos;1;1ra.ed.;1965.;5493
Curso de finanzas y derecho tributario : ;De Juano, Manuel;parte general.;2;1ra.ed.;1963.;5494
Curso de finanzas y derecho tributario : ;De Juano, Manuel;el sistema tributario y los tributos en particular.;2;1ra.ed.;1963.;5495
Análisis y casos prácticos del impuesto general sobre la renta de las personas físicas.;Bañales, Ramiro;sin datos;1;1ra.ed.;1968.;5496
Jornadas Internacionales de Derecho Fiscal.;sin datos;sin datos;1;1ra.ed.;1961.;5497
Imposición a los réditos de capitales y valores mobiliarios.;Bomchil, Miguel;sin datos;1;1ra.ed.;1945.;5498
Derecho tributario argentino.;Martínez, Francisco;sin datos;1;1ra.ed.;1956.;5499
Derecho penal tributario.;Villegas, Héctor Belisario;sin datos;1;1ra.ed.;1965.;5500
El hecho generador de la obligación tributaria.;Araujo Falcao, Amilcar De;sin datos;4;1ra.ed.;1964.;5501
La evasión tributaria.;Giorgetti, Armando;sin datos;2;1ra.ed.;1967.;5502
Modernización de la administración de rentas públicas.;sin datos;sin datos;1;2da.ed.;1962.;5503
Manual de contribución urbana.;Turpin Vargas, José;sin datos;1;1ra.ed.;1965.;5504
La interpretación de la ley tributaria.;García Belsunce, Horacio A;sin datos;1;1ra.ed.;1959.;5505
Ensayos sobre administración política y derecho tributario.;sin datos;sin datos;2;1ra.ed.;1968.;5506
Impuesto municipal a las actividades lucrativas : ;García, Ricardo;convenios multilaterales para evitar la doble imposición.;1;1ra.ed.;1969.;5507
El concepto de rédito en la doctrina y en el derecho tributario.;Garcia Belsunce, Horacio A.;sin datos;1;1ra.ed.;1967.;5508
Curso de impuestos : ;Jarach, Dino;doctrina, ejercicios de aplicación, problemas y soluciones.;1;1ra.ed.;1957.;5509
Curso de impuestos : ;Jarach, Dino;doctrina, ejercicios de aplicación, problemas y soluciones.;1;mra.ed.;1957.;5510
Curso de impuestos : ;Jarach, Dino;doctrina, ejercicios de aplicación, problemas y soluciones.;1;1ra.ed.;1957.;5511
Curso de impuestos : ;Jarach, Dino;doctrina, ejercicios de aplicación, problemas y soluciones.;1;1ra.ed.;1957.;5512
Curso de impuestos : ;Jarach, Dino;doctrina, ejercicios de aplicación, problemas y soluciones.;1;1ra.ed.;1957.;5513
Curso de impuestos : ;Jarach, Dino;doctrina, ejercicios de aplicación, problemas y soluciones.;1;1ra.ed.;1957.;5514
Curso de impuestos : ;Jarach, Dino;doctrina, ejercicios de aplicación, problemas y soluciones.;1;1ra.ed.;1957.;5515
Curso de impuestos : ;Jarach, Dino;actualizaciones.;1;1ra.ed.;1957.;5516
Curso de impuestos : ;Jarach, Dino;doctrina, ejercicios de aplicación, problemas y soluciones.;1;1ra.ed.;1957.;5517
La tributación en la Argentina.;sin datos;sin datos;1;1ra.ed.;1969.;5518
El impuesto a los reditos.;López, Alberto T;sin datos;1;3ra.ed.;1951.;5519
El impuesto a los reditos.;López, Alberto T;sin datos;1;3ra.ed.;1951.;5520
El impuesto a los reditos.;Reig, Enrique Jorge;sin datos;2;5ta.ed.;1970.;5521
El impuesto a las ventas : ;Reig, Enrique Jorge;estudio teórico práctico del gravamen argentino, precedido por el análisis de la teoría general del impuesto ...;2;5ta.ed.;1959.;5522
Impuesto a las actividades lucrativas.;La Rosa, Ricardo;sin datos;1;1ra.ed.;1954.;5523
Impuesto a las ganancias eventuales : ;Rabinovich, Marcos;exposición y comentario.;1;1ra.ed.;1959.;5524
Timbre del estado.;Amoros Rica, Narciso;sin datos;1;1ra.ed.;1961.;5525
Derecho tributario argentino.;Andreozzi, Manuel;sin datos;1;1ra.ed.;1951.;5526
Derecho tributario argentino.;Andreozzi, Manuel;sin datos;1;1ra.ed.;1951.;5527
Derecho tributario : ;Amoros Rica, Narciso;explicaciones.;1;1ra.ed.;1963.;5528
Sociedades de economía mixta.;Camara, Héctor;sin datos;1;1ra.ed.;1951.;5529
La doctrina cooperativa.;Lambert, Paul;sin datos;1;2da.ed.;1959.;5530
Sociedades comerciales.;Ader, José Jorge;sin datos;2;1ra.ed.;1963.;5531
Legislación argentina y comparada : ;Veliz, Ricardo R;la sociedad cooperativa su régimen legal y práctico.;1;1ra.ed.;1959.;5532
Organización de las sociedades cooperativas.;Moirano, Armando A;sin datos;1;7ma.ed.;1961.;5533
La sociedad anónima actual.;sin datos;sin datos;1;1ra.ed.;1963.;5534
La sociedad anónima actual.;sin datos;sin datos;1;1ra.ed.;1963.;5535
La sociedad anónima actual.;sin datos;sin datos;1;1ra.ed.;1963.;5536
La sociedad anónima actual.;sin datos;sin datos;1;1ra.ed.;1963.;5537
La sociedad anónima actual.;sin datos;sin datos;1;1ra.ed.;1963.;5538
La sociedad anónima actual.;sin datos;sin datos;1;1ra.ed.;1963.;5539
La sociedad anónima actual.;sin datos;sin datos;2;1ra.ed.;1963.;5540
La sociedad anónima actual.;sin datos;sin datos;1;1ra.ed.;1963.;5541
La sociedad anónima actual.;sin datos;sin datos;1;1ra.ed.;1963.;5542
La sociedad anónima actual.;sin datos;sin datos;1;1ra.ed.;1963.;5543
Cooperativas de producción : ;Riaza Ballesteros, José M;experiencias y futuro.;1;1ra.ed.;1967.;5544
Validez de los contratos de las sociedades anónimas con sus directores.;Morandi, Juan Carlos Félix;sin datos;1;1ra.ed.;1959.;5545
Manual de teoría y técnica impositiva : ;Mc Ewan, Héctor C;teoría y práctica.;2;1ra.ed.;1967.;5546
El régimen jurídico fiscal de las cooperativas españolas.;Amoros Rica, Narciso;sin datos;1;1ra.ed.;1952.;5547
El régimen jurídico fiscal de las cooperativas españolas.;Amoros Rica, Narciso;sin datos;1;1ra.ed.;1955.;5548
Las sociedades anónimas : ;Fischer, Rodolfo;su régimen jurídico.;1;1ra.ed.;1934.;5549
Sociedades comerciales : ;Halperin, Isaac;parte general.;1;1ra.ed.;1964.;5550
Manual de sociedades anónimas.;Halperin, Isaac;sin datos;1;1ra.ed.;1962.;5551
Sociedades de responsabilidad limitada.;Halperin, Isaac;sin datos;1;1ra.ed.;1960.;5552
Sociedades de responsabilidad limitada.;Halperin, Isaac;sin datos;1;5ta.ed.;1966.;5553
Sociedades de responsabilidad limitada.;Halperin, Isaac;sin datos;7;6ta.ed.;1972.;5554
Manual de sociedades comerciales : ;Caletti, Alberto Mario;régimen legal, contable, impositivo.;1;1ra.ed.;1956.;5555
Manual jurídico práctico de sociedades anónimas.;Lux Wurm, Pedro Carlos;sin datos;1;5ta.ed.;1962.;5556
Constitución y funcionamiento de las sociedades anónimas : ;González Ruiz, Jorge;régimen legal y administrativo.;2;1ra.ed.;1960.;5557
La sociedad anónima : ;Colimodio, José María;actos constitutivos y funcionales.;2;1ra.ed.;1960.;5558
Disolución y liquidación de sociedades mercantiles.;Camara, Héctor;sin datos;1;2da.ed.;1959.;5559
Transformacion de sociedades comerciales.;Arata, Roberto Mario;sin datos;1;1ra.ed.;1966.;5560
Disolución de la sociedad anónima por retiro de la autorización gubernativa : ;Camara, Héctor;notas de derecho argentino y comparado.;1;1ra.ed.;1954.;5561
Los dividendos de las sociedades anónimas.;Sussini, Miguel;sin datos;1;1ra.ed.;1951.;5562
Curso de derecho de sociedades anonimas.;Rubio, Jesús;sin datos;1;1ra.ed.;1964.;5563
La sociedad anónima en la sociedad moderna.;Mason, Edward S;sin datos;1;1ra.ed.;1967.;5564
Elementos de derecho societario.;Giménez Casal, Ramón;sin datos;1;1ra.ed.;1967.;5565
Sociedades anónimas.;Alegria, Héctor;sin datos;1;1ra.ed.;1963.;5566
Breves nociones de reaseguro.;Segura, Luis G.;sin datos;1;1ra.ed.;1954.;5567
Sociedades anónimas.;Di Guglielmo, Pascual;sin datos;1;1ra.ed.;1964.;5568
Impuestos nacionales.;sin datos;sin datos;1;2da.ed.;1961.;5569
Impuestos nacionales : ;sin datos;texto ordenado en 1968.;1;1ra.ed.;1968.;5570
Finanzas públicas y política presupuestaria.;Williams, Alan;sin datos;2;2da.ed.;1965.;5571
Manual de derecho privado II.;Frutos, Pedro;sin datos;4;1ra.ed.;1968.;5572
Código de minería y legislación de hidrocarburos.;Pigretti, Eduardo A.;sin datos;1;2da.ed.;1964.;5573
Impuesto a las ventas : ;Castro, Juan Pedro;ejercicios de liquidación.;1;1ra.ed.;1970.;5574
Las ficciones en el derecho tributario.;Perez De Ayala, José Luis;sin datos;1;1ra.ed.;1970.;5575
