Titulo_Libro;Autor;Subtitulo_Libro;Cantidad_Ejemplares;Edicion;Año_Publicacion;Item_Number
Política económica : ;Moreno Quintana, Lucio M;ensayo acerca de una sistematización integral.;1;1ra.ed.;1944.;2464
Política económica : ;Moreno Quintana, Lucio M.;ensayo acerca de una sistematización integral.;1;1ra.ed.;1944.;2465
Principios de economía.;Vignau, Julio Aníbal;sin datos;7;1ra.ed.;1962.;2466
Principios de economía.;Vignau, Julio Aníbal;sin datos;7;1ra.ed.;1962.;2467
Economía política del trabajo.;Sultan, Paul;sin datos;1;1ra.ed.;1964.;2468
Principios de economía.;Taussig, F. W;sin datos;1;2da.ed.;1951.;2469
Curso de economía política.;Gide, Charles;sin datos;2;2da.ed.;1955.;2470
Curso de economía política.;Gide, Charles;sin datos;2;3ra.ed.;1959.;2471
Ingreso nacional y corriente de fondos : ;Powelson, John P;conceptos, contabilidad y análisis.;1;1ra.ed.;1963.;2472
Ensayos sobre economía impositiva.;Musgrave, Richard A.;sin datos;3;1ra.ed.;1964.;2473
Estructura de la economía : ;Hicks, John Richard;introducción al estudio del Ingreso Nacional.;1;3ra.ed.;1961.;2474
Estructura de la economía : ;Hicks, John Richard;introducción al estudio del Ingreso Nacional.;1;7ma.ed.;1963.;2475
Estructura de la economía : ;Hicks, John Richard;introducción al estudio del Ingreso Nacional.;1;9na.ed.;1966.;2476
Teoría monetaria y política fiscal.;Hansen, Alvin H;sin datos;9;2da.ed.;1960.;2477
Teoría del desenvolvimiento económico : ;Schumpeter, Joseph Alois;una investigación sobre ganancias, capital, crédito, interés y ciclo económiico.;1;2da.ed.;1957.;2478
Teoría del desenvolvimiento económico : ;Schumpeter, Joseph Alois;una investigación sobre ganancias, capital, crédito, interés y ciclo económico.;1;4ta.ed.;1967.;2479
Ensayos de samántica económica.;Machlup, Fritz;sin datos;1;1ra.ed.;1962.;2480
Teoría general de la ocupación, el interés y el dinero.;Keynes, John Maynard;sin datos;1;3ra.ed.;1958.;2481
Las etapas del crecimiento económico : ;Rostow, W. W;un manifiesto no comunista.;4;1ra.ed.;1961.;2482
Las etapas del crecimiento económico : ;Rostow, W. W;un manifiesto no comunista.;2;2da.ed.;1963.;2483
Las etapas del crecimiento económico : ;Rostow, W. W;un manifiesto no comunista.;1;3ra.ed.;1965.;2484
Microeconomía.;Breit, William;sin datos;1;2da.ed.;1973.;2485
Teoría económica y regiones subdesarrolladas.;Myrdal, Gunnar;sin datos;3;1ra.ed.;1962.;2486
Planeación del desarrollo económico.;Hagen, Everett E;sin datos;1;1ra.ed.;1964.;2487
Ensayos sobre análisis económico.;Robinson, Joan;sin datos;1;1ra.ed.;1964.;2488
Hacia una dinámica del desarrollo latinoamericano.;Prebisch, Raúl;sin datos;1;1ra.ed.;1963.;2489
Programación del desarrollo económico.;Benard, Jean;sin datos;1;1ra.ed.;1965.;2490
Teorías del desarrollo económico.;Adelman, Irma;sin datos;1;1ra.ed.;1964.;2491
Integración de la América latina : ;Wionczek, Miguel S;experiencia y perspectivas.;1;1ra.ed.;1964.;2492
Economía de los sistemas de transporte.;Voigt, Fritz;sin datos;1;1ra.ed.;1964.;2493
El ingreso y la riqueza.;Kuznets, Simón;sin datos;1;1ra.ed.;1963.;2494
Economía política : ;Guaresti, Juan José;intercambio internacional, las oscilaciones económicas ...;4;1ra.ed.;1965.;2495
Ensayos sobre el ciclo económico.;Haberler, Gottfried;sin datos;1;2da.ed.;1956.;2496
Ensayos sobre la teoría de los precios.;Stigler, George J;sin datos;2;1ra.ed.;1960.;2497
Ensayos sobre teoría de los precios.;Stigler, George J;sin datos;1;3ra.ed.;1968.;2498
Productividad y progreso.;Hutton, Graham;sin datos;1;1ra.ed.;sin datos;2499
Introducción al razonamiento económico.;Robinson, Marshall A.;sin datos;1;1ra.ed.;1965.;2500
La teoría económica de John Maynard Keynes : ;Dillard, Dudley;teoría de una economía monetaria.;1;1ra.ed.;1960.;2501
La teoría económica de John Maynard Keynes : ;Dillard, Dudley;teoría de una economía monetaria.;10;9na.ed.;1971.;2502
El dinero y las esctructuras monetarias.;Olarra Jimenez, Rafaél;sin datos;1;1ra.ed.;1965.;2503
Camino de la supervivencia.;Vogt, William;sin datos;1;1ra.ed.;1952.;2504
Enseñanzas básicas de los grandes economistas.;Mcconnell, John W;sin datos;1;1ra.ed.;1961.;2505
Política antiinflacionista.;Harrod, Roy Forbest;sin datos;1;1ra.ed.;1961.;2506
Manual de econometría.;Klein, Lawrence R.;sin datos;2;1ra.ed.;1958.;2507
Argentina y el Mercado Común Europeo.;Pellegrini, Vicente;sin datos;1;1ra.ed.;1963.;2508
Ayuda económica y subdesarrollo.;Benham, Frederic;sin datos;2;1ra.ed.;1965.;2509
Desarrollo económico : ;Calderwood, James D.;la experiencia norteamericana.;1;1ra.ed.;1964.;2510
Fronteras psicológicas de la economía : ;Lauterbach, Albert;hombre, motivaciones y dinero.;3;1ra.ed.;1963.;2511
Control de producción.;O'donnell, Paul D.;sin datos;1;1ra.ed.;1955.;2512
Instituciones financieras.;Duverger, Maurice;sin datos;1;1ra.ed.;1960.;2513
Se puede controlar la inflación?;Moulton, Harold G;sin datos;1;1ra.ed.;1962.;2514
El sistema económico.;Di Fenizio, Ferdinando;sin datos;1;1ra.ed.;1961.;2515
Adónde va el trabajo humano?;Friedman, Georges;sin datos;1;1ra.ed.;1961.;2516
Teoría del desarrollo económico.;Lewis, W. Arthur;sin datos;1;1ra.ed.;1958.;2517
Solidaridad o desintegración : ;Myrdal, Gunnar;tendencias actuales de las relacions económicas internacionales en el mundo no soviético.;1;1ra.ed.;1956.;2518
Teorías de la población y su interpretación económica.;Coontz, Sydney H;sin datos;2;1ra.ed.;1960.;2519
El desarrollo económico y América Latina.;Ellis, Howard S;sin datos;3;1ra.ed.;1960.;2520
Investigación económica : ;Max, Hermann;su metodología y su técnica.;1;1ra.ed.;1963.;2521
Problemas de formación de capital en los países insuficientemente desarrollados.;Nurske, Ragnar;sin datos;1;2da.ed.;1960.;2522
Curso elemental de economía.;Scott, H. M;sin datos;1;3ra.ed.;1958.;2523
Elementos de análisis económico.;Mcisaac, Archibald M;sin datos;1;2da.ed.;1960.;2524
Dinero.;Robertson, Dennis H;sin datos;1;3ra.ed.;1955.;2525
El capitalismo contemporáneo.;Strachey, John;sin datos;1;1ra.ed.;1960.;2526
Técnica bancaria.;Aldrighetti, Angelo;sin datos;2;5ta.ed.;1960.;2527
Teoría de la dinámica económica : ;Kalecki, Michael;ensayo sobre los movimientos ciclicos y a largo plazo de la economía capitalista.;1;1ra.ed.;1956.;2528
Tratado sobre los ciclos económicos.;Estey, James Arthur;sin datos;7;5ta.ed.;1964.;2529
Nueva política comercial para el desarrollo.;Prebisch, Raúl;sin datos;1;1ra.ed.;1964.;2530
Teoría de la competencia monopólica.;Chamberlin, Edward Hastings;sin datos;2;2da.ed.;1956.;2531
La inversion bursatil.;Alemann, Juan E.;sin datos;2;1ra.ed.;1962.;2532
Introducción a la economía laboral.;Phelps, Orme W;sin datos;1;1ra.ed.;1964.;2533
Política agrícola : ;Fernández y Fernández, Ramón;ensayo sobre normas para México.;1;1ra.ed.;1961.;2534
La dimensión más económica de la empresa.;Cholvis, Francisco;sin datos;1;1ra.ed.;1952.;2535
Inflación y sociedad.;Hutton, Graham;sin datos;1;1ra.ed.;1962.;2536
Economía del desarrollo.;Gannage, Elias;sin datos;1;1ra.ed.;1964.;2537
Introducción a la dinámica económica.;Zamora, Francisco;sin datos;1;2da.ed.;1962.;2538
Métodos de desarrollo industrial y su aplicación a los países en vías de desarrollo.;sin datos;sin datos;1;1ra.ed.;1963.;2539
Teoría de los precios de la construcción.;Niklison, Carlos A;sin datos;1;1ra.ed.;1953.;2540
Oro y oro patrón : ;Kemmerer, Edwin Walter;historia de la moneda oro su pasado, presente y futuro.;1;1ra.ed.;1959.;2541
Dinero, comercio internacional y crecimiento económico.;Johnson, Harry G;sin datos;1;1ra.ed.;1965.;2542
Fondos comunes de inversión.;Castro Corbat, Marcelo J.;sin datos;1;1ra.ed.;1965.;2543
Los paises subdesarrollados.;Ropke, Wilhelm;sin datos;1;1ra.ed.;1960.;2544
Los grandes mercados del  mundo.;George, Pierre;sin datos;2;2da.ed.;1963.;2545
Los paises subdesarrollados.;Lacoste, Yves;sin datos;1;2da.ed.;1963.;2546
La economía humana.;Sand, René;sin datos;1;2da.ed.;1963.;2547
La economía humana.;Sand, René;sin datos;1;3ra.ed.;1968.;2548
Los grandes mercados  del mundo.;George, Pierre;sin datos;1;3ra.ed.;1969.;2549
Un nuevo trato para américa latina : ;Gordon, Lincoln;la alianza para el progreso.;1;1ra.ed.;1964.;2550
Comercio internacional : ;Vanek, Jaroslav;teoría y política económica.;1;1ra.ed.;1964.;2551
Reducciones arancelarias y competencia.;Phillips, Louis;sin datos;1;1ra.ed.;1964.;2552
Estudios sobre desarrollo económico.;Okun, Bernard;sin datos;1;1ra.ed.;1963.;2553
Plan soviético de un estado mundial.;Goodman, Elliot R.;sin datos;1;3ra.ed.;1964.;2554
Las inversiones de capital extranjero en España.;sin datos;sin datos;1;1ra.ed.;1960.;2555
El método de la economía política y de la política económica.;Di Fenizio, Ferdinando;sin datos;1;1ra.ed.;1961.;2556
La función de consumo.;Di Fenizio, Ferdinando;sin datos;1;1ra.ed.;1961.;2557
La evolución económica de la civilización occidental.;Clough, Shepard B.;sin datos;1;1ra.ed.;1962.;2558
Organización e integración económica internacional.;Ropke, Wilhelm;sin datos;1;1ra.ed.;1959.;2559
Sistemas económicos.;Halm, George N;sin datos;1;1ra.ed.;1964.;2560
Equilibrio económico y crecimiento en la economía mundial.;Nurske, Ragnar;sin datos;1;1ra.ed.;1964.;2561
Inflación y teoría monetaria.;Ball, R. J;sin datos;1;1ra.ed.;1965.;2562
Economía para directores de empresa.;Dean, Joel;sin datos;2;1ra.ed.;1960.;2563
Las finanzas del siglo XX y otros ensayos.;Ahumada, Guillermo;sin datos;2;1ra.ed.;1964.;2564
El crédito con sentido común.;Wilson, Charles Morrow;sin datos;2;1ra.ed.;1965.;2565
Economía financiera.;Brochier, H;sin datos;3;1ra.ed.;1960.;2566
Elementos de economía política.;Schop Santos, Ernesto;sin datos;1;2da.ed.;1957.;2567
Elementos de economía política.;Schop Santos, Ernesto;sin datos;1;2da.ed.;1957.;2568
Principios y problemas de cooperativismo.;Bogardus, Mory S.;sin datos;2;1ra.ed.;1964.;2569
Economía de empresa y negocios : ;Colberg, Marshall R.;manual de teoría y casos prácticos.;2;1ra.ed.;1959.;2570
Economía de empresa y negocios : ;Colberg, Marshall R;manual de teoría y casos prácticos.;1;2da.ed.;1965.;2571
Introducción a la ciencia económica contemporánea.;Popescu, Oreste;sin datos;6;2da.ed.;1964.;2572
Política económica de los paises subdesarrollados.;Marrama, Vittorio;sin datos;12;3ra.ed.;1969.;2573
Problemas de pagos en  América Latina.;sin datos;sin datos;1;1ra.ed.;1964.;2574
Los efectos económicos de la política fiscal.;Myrdal, Gunnar;sin datos;1;3ra.ed.;1962.;2575
Incentivos de salarios.;Andrews, George H.;sin datos;1;1ra.ed.;1963.;2576
Dsarrollo económico y comercio internacional.;Zook, Paul D.;sin datos;2;1ra.ed.;1963.;2577
Lecturas sobre la teoría económica del desarrollo.;Rojo Duque, Luis A.;sin datos;1;1ra.ed.;1966.;2578
Economía de los paises en desarrollo.;Myint, H;sin datos;1;1ra.ed.;1965.;2579
Teoría y práctica en la valuación de balances.;Louge, Pedro J.S.;sin datos;1;4ta.ed.;1972.;2580
La industrialización del siglo XX : ;Perroux, Francois;Sansimonismo del siglo XX y creación colectiva.;1;1ra.ed.;1964.;2581
La diplomacia del dolar y la esterlina.;Gardner, Richard N.;sin datos;1;1ra.ed.;1966.;2582
Manifiesto capitalista.;Kelso, Louis O.;sin datos;1;1ra.ed.;1961.;2583
La elaboración de la política económica.;Meynaud, Jean;sin datos;1;1ra.ed.;1961.;2584
El capital financiero.;Hilferding, Rudolf;sin datos;1;1ra.ed.;1963.;2585
Teoría de la población : ;Sireau, Alberto;ecología urbana y su aplicación a la Argentina.;1;1ra.ed.;1966.;2586
Petróleo y vasallaje : ;Rumbo, Eduardo I.;carne de vaca y carnero contra carbón mas petróleo.;1;1ra.ed.;1957.;2587
Fundamentos de la economía de empresa : ;Gutenberg, Erich;la producción.;2;1ra.ed.;1961.;2588
Fundamentos de la economía de empresa : ;Gutenberg, Erich;la venta.;2;1ra.ed.;1961.;2589
Origen y contenido del análisis económico moderno.;Fellner, William;sin datos;1;1ra.ed.;1963.;2590
Tratado de cooperativismo mexicano.;Rojas Coria, Rosendo;sin datos;1;1ra.ed.;1952.;2591
Curso de economía política y social.;Gondra, Luis Roque;sin datos;1;1ra.ed.;1946.;2592
Introducción al razonamiento económico.;Robinson, Marshall A.;sin datos;1;1ra.ed.;1965.;2593
Las carnes en la economía Argentina.;Liceaga, José V;sin datos;1;1ra.ed.;1952.;2594
La economía como ciencia.;Papandreou, Andreas G.;sin datos;1;1ra.ed.;1961.;2595
La verdadera y única ciencia de la economía política : ;Machello, B;manifiesto científico para los pueblos.;1;2da.ed.;1948.;2596
Guía de estudio y libro de ejercicios del curso de economía moderna.;Samuelson, Paul Anthony;sin datos;1;1ra.ed.;1961.;2597
Encyclopedic dictionary of business finance.;sin datos;sin datos;1;1ra.ed.;1967.;2598
Guía de estudio y libro de ejercicios del curso de economía moderna.;Samuelson, Paul Anthony;sin datos;2;3ra.ed.;1964.;2599
Guía de estudio y libro de ejercicios del curso de economía moderna.;Samuelson, Paul Anthony;sin datos;7;4ta.ed.;1968.;2600
Metodología de la ciencia económica : ;Marchal, André;los problemas actuales del análisis económico, sus enfoques fundamentales.;2;1ra.ed.;1958.;2601
La clase obrera y el desarrollo económico.;Galenson, Walter;sin datos;1;1ra.ed.;1964.;2602
La politica económica.;Billy, Jacques;sin datos;2;1ra.ed.;1964.;2603
Argentina potencia mundial.;Noble, Roberto J.;sin datos;1;1ra.ed.;1960.;2604
Crecimiento económico en los Estados Unidos : ;Slichter, Sumner H.;su historia, problemas y perspectivas.;1;1ra.ed.;1965.;2605
Consideraciones sociológicas sobre desarrollo económico de América Latina.;Medina Echavarria, José;sin datos;1;1ra.ed.;1964.;2606
El sistema de precios.;Dorfman, Robert;sin datos;1;1ra.ed.;1966.;2607
Investigación científica : ;Silk, Leonard S;clave del progreso.;1;1ra.ed.;1965.;2608
El ABC de la inflación : ;Kemmerer, Edwin Walter;con referencia especial a las condiciones presentes en los Estados Unidos.;2;1ra.ed.;1953.;2609
Nuevos horizontes de progreso económico.;Seltzer, Lawrence H.;sin datos;1;1ra.ed.;1966.;2610
La teoría monetaria y el ciclo económico.;Hayek, Friedrich A.;sin datos;1;1ra.ed.;1936.;2611
Economía internacional.;Kindleberger, Charles P;sin datos;2;2da.ed.;1967.;2612
Economía internacional.;Kindleberger, Charles P;sin datos;1;4ta.ed.;1964.;2613
Economía internacional.;Kindleberger, Charles P;sin datos;1;6ta.ed.;1967.;2614
Economía internacional.;Kindleberger, Charles P;sin datos;1;7ma.ed.;1972.;2615
Curso de economía Argentina y de economía política.;Álzaga, Orlando Williams;sin datos;2;2da.ed.;1965.;2616
Curso de economía Argentina y de economía política.;Álzaga, Orlando Williams;sin datos;2;2da.ed.;1961.;2617
Problemas económicos actuales.;Lenti, Libero;sin datos;2;1ra.ed.;1963.;2618
Análisis crítico de la economía argentina.;Portnoy, Leopoldo;sin datos;2;1ra.ed.;1961.;2619
Comercialización y análisis del mercado.;Brown, Lyndon O.;sin datos;1;4ta.ed.;1977.;2620
Fundamentos de política económica.;Eucken, Walter;sin datos;1;1ra.ed.;1956.;2621
Valoración de tareas y estructura de salarios.;Lucas Ortueta, Ramón De;sin datos;1;1ra.ed.;1963.;2622
La técnica bancaria y la política de crédito.;Micele, Antonio;sin datos;2;1ra.ed.;1964.;2623
Elementos para el estudio de la economía energética argentina.;González Climent, Aurelio;sin datos;1;1ra.ed.;1955.;2624
Principios de economía.;Garver, Frederick B;sin datos;2;3ra.ed.;1953.;2625
Economía social teórica.;Casel, Gustav;sin datos;2;5ta.ed.;1960.;2626
Principios de economía política.;Conte Mc Donell, Enrique;sin datos;1;2da.ed.;1964.;2627
El programa económico de Kennedt y una mirada hacia el  futuro.;Harris, Seymour E;sin datos;1;1ra.ed.;1966.;2628
Raices del desarrollo económico norteamericano 1607-1861 : ;Bruchey, Stuart;ensayo sobre causalidad social.;1;1ra.ed.;1966.;2629
La economía de la empresa.;Davenport, Herbert Joseph;sin datos;1;1ra.ed.;1953.;2630
Comercialización y análisis del mercado.;Brown, Lyndon O.;sin datos;1;2da.ed.;1965.;2631
Historia de las doctrinas económicas : ;Gide, Charles;de los fisiócratas a John Stuart Mill.;2;1ra.ed.;1949.;2632
Historia de las doctrinas económicas : ;Gide, Charles;de la escuela histórica a John Maynard Keynes.;1;1ra.ed.;1949.;2633
Teoría de política económica.;Robbins, Lionel;sin datos;1;1ra.ed.;1966.;2634
Política económica contemporánea.;Kirschen, Etennie-Sadi;sin datos;2;1ra.ed.;1965.;2635
Teoría de la planificación económica.;Horvat, Branko;sin datos;1;1ra.ed.;1970.;2636
Economía y sociología de la  industria : ;Sargant Florence, P;un análisis realista del desarrollo.;1;1ra.ed.;1966.;2637
Síntesis de la evolución de la ciencia económica y sus métodos.;Schumpeter, Joseph Alois;sin datos;1;1ra.ed.;1964.;2638
Oligopolio y progreso técnico.;Sylos Labini, Paolo;sin datos;3;1ra.ed.;1966.;2639
Producción de mercancías por medio de mercancías : ;Sraffa, Piero;preludio a una crítica económica.;2;1ra.ed.;1966.;2640
Los costes sociales de la empresa privada.;Kapp, K.William;sin datos;2;1ra.ed.;1966.;2641
Renta nacional, contabilidad social y modelos económicos.;Stone, Richard;sin datos;2;1ra.ed.;1966.;2642
Hacia una economía mundial : ;Tinbergen, Jan;sugerencias para una política económica internacional.;2;1ra.ed.;1965.;2643
Tendencias del pensamiento económico.;Samuelson, Paul Anthony;sin datos;4;2da.ed.;1962.;2644
Tendencias del pensamiento económico.;Samuelson, Paul Anthony;sin datos;2;1ra.ed.;1958.;2645
Estructuras y sistemas económicos.;Marchal, André;sin datos;1;1ra.ed.;1961.;2646
Teoría microeconómica : ;Henderson, James M;una aproximación matemática.;1;1ra.ed.;1962.;2647
Aspectos monetarios de las economías latinoamericanas 1960.;sin datos;sin datos;1;1ra.ed.;1961.;2648
Desarrollo económico.;Robock, Stefan H.;sin datos;1;1ra.ed.;1967.;2649
El obrero, base de la sociedad.;Wirtz, W.Willard;sin datos;1;1ra.ed.;1967.;2650
El dilema de la población mundial.;Hauser, Philip M.;sin datos;1;1ra.ed.;1963.;2651
La economía y la idea de humanidad.;Hoselitz, Bert F;sin datos;1;1ra.ed.;1967.;2652
Teoría moderna del capital.;Dewey, Donald;sin datos;1;1ra.ed.;1967.;2653
Una política económica para el mundo libre.;Reuss, Henry S.;sin datos;1;1ra.ed.;1967.;2654
Coexistencia y vulnerabilidad del desarrollo económico.;Kovner, Milton;sin datos;1;1ra.ed.;1967.;2655
oro y poder mundial : ;Rolfe, Sidney E.;el dolar, la libra y los planes de reforma.;1;1ra.ed.;1968.;2656
El poder económico en nuestras luchas civiles :;Odonne, Jacinto;con una carta del doctor Alfredo L.Palacios;1;1ra.ed.;1968.;2657
Compendio de organización y economía industrial.;Nieto, Amilcar Walter;sin datos;1;1ra.ed.;1968.;2658
Cambios sociales en regiones en desarrollo : ;Barringer, Herbert R.;una interpretación de la teoría evolucionista.;1;1ra.ed.;1968.;2659
Los negocios : ;Kappel, Frederick R.;finalidades y funciones.;1;1ra.ed.;1967.;2660
Desarrollo nacional y su funcionamiento.;Cushman Coyle, David;sin datos;1;1ra.ed.;1965.;2661
Nuevos métodos de análisis económico : ;Chorafas, D.N.;su aplicación a los problemas de dirección.;1;1ra.ed.;1965.;2662
Dimensión del mercado y óptimo de producción.;Bandt, Jacques De;sin datos;1;1ra.ed.;1965.;2663
Fluctuaciones económicas.;Guitton, Henri;sin datos;1;1ra.ed.;1965.;2664
El desarrollo económico y la política fiscal.;Forino, Sabatino A.;sin datos;1;1ra.ed.;1966.;2665
Técnica de planificación económica.;Flecha, Agustín O.;sin datos;1;1ra.ed.;1966.;2666
La inflación argentina.;Garcia Martínez, Carlos;sin datos;2;1ra.ed.;1965.;2667
La república económica norteamericana.;Berle, Adolf A.;sin datos;1;1ra.ed.;1968.;2668
la economía en el mundo histórico cultural : ;Ríos, Raúl Arturo;ensayo de fundamentación ontológica de la economía.;2;1ra.ed.;1964.;2669
Las economías de exportación : ;Levin, Jonathan V;esquema de su desarrollo en la perspectiva histórica.;1;1ra.ed.;1964.;2670
Investigación motivacional y dirección de mercados.;Newman, Joseph W;sin datos;1;1ra.ed.;1964.;2671
Principios y práctica de marketing.;Buskirk, Richard H;sin datos;1;5ta.ed.;1967.;2672
La industria nortemaericana : ;Caves, Richard;estructura, conducta y funcionamiento.;1;1ra.ed.;1966.;2673
Criterios de inversion y desarrollo económico.;Tinbergen, Jan;sin datos;1;1ra.ed.;1965.;2674
Economía industrial.;Beacham, A;sin datos;1;1ra.ed.;1954.;2675
Economía de la empresa privada.;Jones, J. Harry;sin datos;1;1ra.ed.;1955.;2676
La economía asunto de todos.;Lerner, Abba P;sin datos;1;1ra.ed.;1965.;2677
Democracia, comunidad y desarrollo.;Maddick, Henry;sin datos;1;1ra.ed.;1966.;2678
El dolar en la economía mundial : ;Aubrey, Henry G;un ensayo sobre política financiera internacional.;1;1ra.ed.;1966.;2679
Ideas de los grandes economistas.;Soule, George;sin datos;1;1ra.ed.;1961.;2680
La empresa y las relaciones públicas.;Finn, David;sin datos;1;1ra.ed.;1964.;2681
Planification générale et intégration économique.;Sauer, Claude;sin datos;1;1ra.ed.;1964.;2682
Policies and methods for industrial development.;Bryce, Murray D.;sin datos;1;1ra.ed.;1965.;2683
Ajusting to technological change.;Somers, Garld G.;sin datos;1;1ra.ed.;1963.;2684
la empresa libre y el progreso.;Horn, Max;sin datos;1;1ra.ed.;1957.;2685
Política de salarios : ;Pascuchi, Margal;cuatro experiencias sobre la relación salario-costo de la vida.;1;1ra.ed.;1957.;2686
Productividad : ;Fourastie, Jean;la esperanza del siglo XX.;1;1ra.ed.;1956.;2687
Dinero y crédito : ;Forstman, Albrecht;los fundamentos de la teoría del dinero y del crédito.;1;1ra.ed.;1960.;2688
Dinero y crédito : ;Forstman, Albrecht;la aplicación de la teoría del dinero y del crédito.;1;1ra.ed.;1960.;2689
El desnivel de capitales entre los paises desarrollados y en desarrollo : ;Kraus Bivens, Karen;causas y remedios.;1;1ra.ed.;1972.;2690
Economía de moneda y banca.;Chandler, Lester V;sin datos;1;1ra.ed.;1970.;2691
Historia de las doctrinas económicas.;Griziotti Kretschmann, Jenny;sin datos;1;1ra.ed.;1951.;2692
Colonización integral en tierra de propiedad común y concesión vitalicia individual y la enfiteusis rivadaviana.;Villalobos Domínguez, C;sin datos;1;1ra.ed.;1953.;2693
Historia de las doctrinas económicas.;Gonnard, Rene;sin datos;1;1ra.ed.;1959.;2694
Introducción al desarrollo económico.;Buchanan, Norman S.;sin datos;1;1ra.ed.;1960.;2695
Política económica.;Watson, Donald S.;sin datos;2;1ra.ed.;1965.;2696
Programación lineal y análisis económico.;Dorfman, Robert;sin datos;4;1ra.ed.;1972.;2697
Teoría económica.;Schneider, Erich;sin datos;1;1ra.ed.;1964.;2698
Teoría económica.;Schneider, Erich;sin datos;1;4ta.ed.;1963.;2699
Teoría económica.;Schneider, Erich;sin datos;5;6ta.ed.;1970.;2700
Teoría económica.;Schneider, Erich;sin datos;2;2da.ed.;1961.;2701
Teoría económica.;Schneider, Erich;sin datos;1;3ra.ed.;1963.;2702
Teoría económica.;Schneider, Erich;sin datos;3;4ta.ed.;1966.;2703
Teoría económica.;Schneider, Erich;sin datos;4;5ta.ed.;1968.;2704
Teoría económica.;Schneider, Erich;sin datos;4;1ra.ed.;1967.;2705
Teoría económica.;Schneider, Erich;sin datos;4;2da.ed.;1970.;2706
Economía poskeynesiana.;Kurihara, Kenneth K;sin datos;1;1ra.ed.;1964.;2707
Temas y ejercicios de teoría económica.;Schneider, Erich;sin datos;3;1ra.ed.;1967.;2708
La imposición fiscal en los paises en desarrollo.;Bird, Richard M.;sin datos;3;1ra.ed.;1968.;2709
La cuestión alemana.;Hubatsch, Walther;sin datos;1;1ra.ed.;1965.;2710
Mas alla de la oferta y la demanda.;Ropke, Wilhelm;sin datos;1;1ra.ed.;1960.;2711
La economía del despegue hacia el crecimiento autosostenido.;Rostow, W. W;sin datos;1;1ra.ed.;1967.;2712
La ALPRO y el desarrollo de América latina.;Assis Grieco, Francisco De;sin datos;1;1ra.ed.;1967.;2713
Finanzas internacionales.;Ward, Richard;sin datos;2;1ra.ed.;1969.;2714
La dirección  económica de la empresa.;Olmi, André;sin datos;1;1ra.ed.;1966.;2715
Valoración de proyectos de inversión.;Peumans, H.;sin datos;1;1ra.ed.;1967.;2716
Economía internacional.;Kenen, Peter B;sin datos;1;1ra.ed.;1968.;2717
El gran cambio.;Allen, Frederick Lewis;sin datos;1;1ra.ed.;1967.;2718
Un examen de  la teoría del comercio internacional.;Habeler, Gottfried;sin datos;1;1ra.ed.;1965.;2719
La economía norteamericana contemporánea : ;Coleman, John R.;dinámica y tranformación.;1;1ra.ed.;1969.;2720
Planificación del desarrollo.;Tinbergen, Jan;sin datos;1;1ra.ed.;1967.;2721
Diseño y efectividad organizacional.;Gilli, Juan José;sin datos;12;1ra.ed.;2000.;2722
Historia de las teorías económicas.;Stavenhagen, Gerhard;sin datos;1;1ra.ed.;1959.;2723
Introducción a la economía política.;Peter, Hans;sin datos;1;1ra.ed.;1957.;2724
Introducción filosófica a la economía : ;Stolzmann, Rodolfo;ensayo de una fundamentación filosófica de la economía política.;1;1ra.ed.;1956.;2725
La nueva teoría económica : ;Paulsen, Andreas;una introducción a la teoría económica de John Maynard Keynes y a la política de pleno empleo.;1;1ra.ed.;1957.;2726
Elementos de ciencia y técnica bancarias.;Muratti, Natalio;sin datos;1;1ra.ed.;1960.;2727
Economía política general.;Zwiedineck-Sudenhorst, Otto Von;sin datos;1;1ra.ed.;1956.;2728
La dimensión optima de la empresa.;Robinson, Edward A. G.;sin datos;1;1ra.ed.;1957.;2729
Metodología de la ciencia económica : ;Marchal, André;los problemas actuales del análisis económico.;1;1ra.ed.;1958.;2730
La gerencia y la empresa.;Frischknecht, Federico;sin datos;1;1ra.ed.;1966.;2731
Consecuencias económicas de la automatizacion.;Einzig, Paul;sin datos;2;1ra.ed.;1961.;2732
El análisis de mercados al servicio de la empresa.;Bouquerel, Fernand;sin datos;2;1ra.ed.;1961.;2733
Auge y prosperidad sin inflación.;Wernette, John Philip;sin datos;4;1ra.ed.;1963.;2734
La economía de la vida cotidiana.;Williams, Gertrude;sin datos;2;1ra.ed.;1965.;2735
Problemas económicos actuales.;Lenti, Libero;sin datos;2;2da.ed.;1963.;2736
